,企業名,キャッチコピー,ステータス,給与
140,株式会社タウンハウジング | 【CMも放映！今期過去最高益の見込】1都3件に102店舗展開！,【ルームアドバイザー】★個人ノルマなし　★長期休暇たっぷり！ 正社員,正社員,"◆月給24万5,000円以上 ＋ 充実の手当 ＋ 歩合給 ※経験・年齢を考慮のうえ、当社規定により優遇いたし…"
141,株式会社優誠 | 【大阪府緊急雇用対策に賛同】ノルマなし＆成約率は50％以上！,【営業スタッフ】未経験OK／月収100万円超も可能／基本土日休み 正社員,正社員,"月給23万5,000円〜35万円＋インセンティブ＋諸手当＋賞与 ※年齢・経験・スキルを考慮の上、当社規定に…"
142,株式会社ビッグモーター | マイカー通勤OK◆年収例500万円（26歳：未経験入社3年目）,未経験歓迎★1～2時間の短距離★普通免許でOK【配送ドライバー】 正社員,正社員,月給27万8600円〜40万円 ＋ 賞与年2回 ＋ 諸手当 ※スキル・経験等を考慮し、決定いたします。 ※配送手…
143,株式会社九州エネコ | 《年収例／3年目 880万円／3年目 738万円／6年目 1421万円》,★年休120日以上/完休2日制/転勤なし/社員寮あり★【営業】 正社員,正社員,"月給27万円 + 歩合給（1件あたり7〜10万円） ★年収1,000万円以上が多数在籍！ ★経験が無い方でも安心し…"
144,株式会社ハマエンジニアリング | 賞与年3回支給★20代で年収450万円超えも可能／web面接実施中,＼大分・長崎限定採用／ 【半導体メンテスタッフ】※交代勤務 正社員,正社員,"月給170,000円〜400,000円 ＋ 賞与年3回 ＋ 各種手当 ※研修期間は約2週間を予定（条件変更無） ※残業…"
145,株式会社テクトン | WEB面接可／年間休日125日／土日祝休み／残業少なめ,スキルアップもプライベートも満喫できる！【ITエンジニア】 正社員,正社員,■月給30万円〜70万円 ※前職給与・経験・年齢・能力などを考慮して、給与額を決定します。 ※30時間分の…
146,株式会社アイエスエフネット | 【大阪府緊急雇用対策に賛同】★在宅勤務OK★年間休日126日,年収200万UP実績あり【インフラエンジニア】★選べるキャリア 正社員,正社員,【月給40万円~】＋インセンティブ賞与(月~20万/年~240万)・諸手当を別途支給 ★経験・スキルを考慮して…
147,株式会社コシダカ | 【上場グループ企業】月8~10日休★土日休みもOK★年2回5連休あり,研修充実★【カラオケ店舗社員(店長候補)】※高卒以上/年齢不問 正社員,正社員,エリア別の月給になります。 【A】月給23万円〜48万円 【B】月給22万円〜47万円 【C】月給21万円〜46万…
148,株式会社アイエスエフネット | 【大阪府緊急雇用対策に賛同】★インセンMAX60％★残業ほぼナシ,月35万～【ITエンジニア】★有給消化81％★在宅勤務OK／学歴不問 正社員,正社員,【月給35万円~】＋インセンティブ賞与(月~20万/年~240万)・諸手当 ▼設計構築5年以上の経験者 【月給40…
149,DSP株式会社 | 入社半年で月収100万円以上の社員多数/大阪府緊急雇用対策に賛同,アニメやスポーツ番組の【反響営業】完全週休2日★学歴不問！ 正社員,正社員,月給22万円〜51万円＋インセンティブ ※上記に固定残業38時間分(4万9千円〜)を含む。超過分は別途支給。 …
150,株式会社コシダカ | 【上場グループ企業】スピード昇格可★土日休みOK★年2回5連休,月30万を目指せる【カラオケ店員(店長候補)】*39歳以下/学歴不問 正社員,正社員,エリア別の月給になります。 【A】月給23万円〜48万円 【B】月給22万円〜47万円 【C】月給21万円〜46万…
151,株式会社アイエスエフネット | 【大阪府緊急雇用対策に賛同】★インセンMAX60％/69％が毎年昇給,年休126日×平均残業7.8h【ITエンジニア】在宅勤務OK／高卒以上 正社員,正社員,<東京/埼玉/神奈川/千葉> (1)月給27万円~＋インセンティブ賞与・諸手当 <静岡/愛知/大阪> (2)月給26.5万…
152,株式会社ビッグモーター | 業界No.1企業／賞与年2回／年収800万円以上可能／残業少なめ,インセンあり！【自動車の整備スタッフ】◆未経験歓迎※45歳以下 正社員,正社員,"月給22万8,600円〜60万円＋インセンティブ（月平均10〜20万円）＋諸手当 ※スキル・経験等を考慮し、決…"
153,株式会社コシダカ | 【上場グループ企業】土日休みOK★月収29.4万円も目指せる！,社員評価90点越えの働きやすさ！【店舗マネージャー】★高卒以上 正社員,正社員,エリア別の月給になります。 【A】月給23万円〜48万円 【B】月給22万円〜47万円 【C】月給21万円〜46万…
154,株式会社コシダカ | ★月収例29万4000円！★年休110日以上★東証一部上場グループ,カラオケ好き集合♪【カラオケ店舗社員】※職歴/学歴/年齢不問 正社員,正社員,エリア別の月給になります。 【A】月給23万円〜48万円 【B】月給22万円〜47万円 【C】月給21万円〜46万…
155,ヒカリ電気土木株式会社 | 設立以来、増収増益で絶好調！成長性＆安定性を備えた優良企業,【技術スタッフ】★年休110日 ★賞与年3回/資格取得支援あり 正社員,正社員,月給20万円〜40万円 ＋残業代 ＋各種手当＋賞与年3回 ★モデル年収／年収450万円／33歳／入社2年 ※今回…
156,光電気工事株式会社 | 『 年休120日～×雰囲気◎×新社屋勤務 』★転職者15名活躍中！,転職者に選ばれ、定着率も良い！【総合職】*名古屋市で転勤なし* 正社員,正社員,月給20万円〜50万円（一律手当含む） ※上記月給は、経験、能力、年齢に応じて決定します。 ※経験者は前…
157,小金井不動産株式会社 | LIXIL不動産ショップNo.1！全加盟店480社中優秀成績者41名輩出,<経験者優遇/未経験入社94％>反響型【売買営業】※平均年収650万 正社員,正社員,【月給】25万円〜35万円＋インセンティブ＋諸手当 ※平均インセンティブ額13.7万円 ※試用期間3ヶ月 上記…
158,大和総合住設株式会社 | ★賞与年4回支給★平均年齢27歳！女性社員も活躍しています！,完全週休2日制&朝はゆっくり13時出社♪【提案営業】※福岡勤務 正社員,正社員,月給23万円 〜 40万円 ＋ インセンティブ ★未経験入社で、 　月収47万円を稼いでいる社員もいます！ …
159,メットライフ生命保険株式会社 | 【大阪梅田エイジェンシーオフィス】賞与年4回／土日祝休み！,未経験歓迎！お客さまの未来に寄り添う【コンサルティング営業】 正社員,正社員,◆初任給月給：25万円または30万円 （基本給10万円+初期補給15万円または20万円）+業績給 ※初期補給の…
160,日本交通株式会社 | 運転は4～5時間程度／社員の平均年収「500万円」,【ハイヤードライバー】未経験歓迎／土日休み可／ノルマなし 正社員,正社員,試用期間中：月給25万円（3ヶ月） ※上記は法定研修後3ヶ月間の最低保証額です★保障給制 ※交通費別途…
161,株式会社ユタカホーム | ★残業1日1H以下★転勤ナシ★定着率97％★未経験の先輩多数,【施工管理】★未経験でも月給35万円以上＋インセンティブ！ 正社員,正社員,◆月給：35万円以上+インセンティブ ◎経験・スキルに応じて優遇します。 ◎案件数に応じてインセンティ…
162,ヴェル・ハウジング株式会社 | 安心の固定給制度あり⇒未経験でも月給28万～35万円スタート！,未経験OK！年収1000万超も目指せる【住宅営業】★100％反響営業 正社員,正社員,経験者：月給30万円以上＋インセンティブ 未経験者：月給28万円〜35万円＋インセンティブ ※年齢、経験…
163,株式会社綜合キャリアオプション | グループ全体売上1000億円以上◆社員2000名超◆管理職も目指せる,30期連続黒字の安定企業での【法人営業】★期待の新規事業へ挑戦 正社員,正社員,年俸500万円〜650万円スタート ※経験・スキル・前職の給与等を考慮の上、決定します。 ※試用期間3ヵ月…
164,株式会社大成社 | ★話だけ聞きたいでもOK！お気軽にご応募下さい！★副業もOK,案件単価の75%を給与に還元【ITエンジニア（開発・インフラ）】 正社員,正社員,月給35万円〜90万円＋諸手当（残業手当100%支給、交通費全額） ※経験、スキル、案件単価等を考慮した上…
165,株式会社あいらいふ | ★《20～30代の社員が多数活躍中！》業界未経験・第二新卒歓迎◎,入居者と施設を繋ぐ【コーディネーター】月給30万円以上★ 正社員,正社員,月給30万円〜 ＋ インセンティブ ※経験・能力・スキル等を考慮の上、当社規定により決定します。 ※上記…
166,株式会社セントラルアセット | 一人一人のお客様を大切にサポートするのが当社の魅力です,【賃貸管理アドバイザー】土日祝休み／高額歩合／性別・学歴不問 正社員,正社員,月給25万円(宅建保持者+3万円)+賞与+インセンティブ ★選べる給与制度★ 月給27万円(宅建保持者+3万円)+…
167,株式会社ホームワン | 『年収アップ』や『働き方改善』が転職理由なら当社で決まり！,★アポ不要の100%反響営業【不動産仲介スタッフ】*週休2日制 正社員,正社員,◆月給20万円以上 + 歩合給 ★年収例600万円 ／ 経験2年 ※試用期間4か月あり（同条件） ※契約手数料の2…
168,株式会社テックコーポレーション | ＜ 経済産業省・自治体・事業団体の補助金対象 ＞,【法人営業(自社製品の提案) 】※30～40代の中途入社多数 正社員,正社員,◆東京／月給30万円以上（試用期間は月給27万円以上） ＋ 賞与 ＋ インセンティブ給 ◆大阪、名古屋／月…
169,株式会社センス | ★未経験からでも年収1000万円超の先輩が活躍中★100％面接保証,【営業系総合職】週休3日／月末5連休などユニークな働き方も◎ 正社員,正社員,月給:24万円〜70万円＋インセンティブ＋各種手当 ※経験・スキルを考慮して決定いたします。 ※試用期間…
170,小金井不動産株式会社 | LIXIL不動産ショップNo.1！全加盟店480社中優秀成績者41名輩出,成果に繋がる理由だらけ★【売買営業(反響型)】※栃木限定募集 正社員,正社員,【月給】25万円〜35万円＋インセンティブ＋諸手当 ※平均インセンティブ額13.7万円 ※試用期間3ヶ月 上記…
171,イッセイコンサルタント株式会社 | 【 10年連続売上UP 】平均年収600～700万｜転勤なし｜定時退社可,☆未経験歓迎☆【業務管理スタッフ】内勤メイン／年休122日★ 正社員,正社員,月給25万〜60万円 【月給例】 月給25万円／入社1年（27歳） 月給35万円／経験5年（30歳） 月給50万円／…
172,クラウンコンサルティング株式会社 | ビジネスマッチングサイト『ビジェント』を運営する急成長企業！,【メディアプランナー(広告営業)】テレワーク推奨／フレックス 正社員,正社員,月給25万円以上＋賞与年2回 ※経験、能力を考慮の上、決定いたします。 ※上記には、固定残業代（月15時…
173,株式会社ジーアフター | ◆不況知らず！売上前年比130％以上、注目の企業◆残業ほぼなし,大型店オープン！完全反響【営業】未経験OK◆平均月収48.8万円 正社員,正社員,月給30万円〜(経験・年齢考慮)＋インセンティブ ※上記の月給には時間外労働の有無にかかわらず、45時…
174,居藏管工株式会社 | いぐらかんこう｜#入社祝い金支給#経験者は月収40万円が目指せる,働き方が選べる！【メンテナンス】※未経験歓迎&経験者は優遇 正社員,正社員,"（1）月給33万円以上 （2）月給29万7,000円以上 （3）月給27万5,000円以上 （4）月給29万円以上 （5）月…"
175,株式会社ドリームホーム | 京都屈指の業績・2019年度グループ売上高170億円！,完全反響対応の【不動産営業職】★ノルマ一切なし 正社員,正社員,"月給／22万5,000円以上 ※試用期間2ヵ月。(その間の給与変動なし) ※経験・年齢を考慮の上、当社規定によ…"
176,株式会社エストゥルース | 【当社の実話】土日祝休み/残業ゼロ/未経験入社でも年収1200万円,【不動産営業】＼育成枠採用／⇒チームであなたを育てます 正社員,正社員,【大卒以上】月給25万円以上＋諸手当＋インセンティブ（40万円〜100万円） 【上記以外】月給23万円以上＋…
177,株式会社ゼディアルーク | グループ会社を複数擁し、IT事業を展開する成長企業,経験を活かして、セカンドステップを見出せる【ITエンジニア】 正社員,正社員,月給18万円〜80万円 ＋ インセンティブ（プロジェクト単位での業績に応じる） ※あなたの経験・年齢を考…
178,株式会社エコ・エー | 【環境職人】★寮完備（月3万円）★残業月10ｈ・直行直帰OK,【施工スタッフ】★未経験歓迎★月30万円スタート可★若手活躍中 正社員,正社員,日給1万3000円〜1万7000円 【収入例】月収29万9000円（未経験１ヶ月目） 未経験でも日給1万3000円×23日…
179,株式会社リンクスタッフグループ | ◆未経験スタートでも月給25万円以上を保証！◆早期昇格も,"""本気""で転職を考えるなら、成果に見合った待遇を【人材系営業】 正社員",正社員,■月給25万円〜40万円 + インセンティブ ＋ 賞与年2回 ※スキル・経験を考慮して決定いたします ※試用期…
180,大和総合住設株式会社 | ★賞与年4回支給★平均年齢27歳！女性社員も活躍しています！,＼沖縄勤務／完全週休2日制&朝はゆっくり13時出社♪【提案営業】 正社員,正社員,月給23万円 〜 40万円 ＋ インセンティブ ★未経験入社で、 　月収47万円を稼いでいる社員もいます！ …
181,日本セキュリティ株式会社 | 早期キャリアアップ可能！★お客様は安定の警備業界,人と企業をつなぐ【提案営業】★年休120日以上★長期連休も可 正社員,正社員,■月給25万円〜40万円 + インセンティブ ＋ 賞与年2回 ※スキル・経験を考慮して決定いたします ※試用期…
182,クレストジャパン株式会社 | ★経験者採用★年収1000万以上目指す人、必見の求人です！,"""稼ぎたい""その想いに高歩合率で応えます【不動産仲介・仕入れ】 正社員",正社員,月給25万円〜30万円＋仲介手数料20％の高率歩合 ※試用期間3ヶ月あり（期間中の待遇に変更ナシ） ＜歩合…
183,株式会社ビルドイット | 設計からの請負い案件100％で高収入可 ★残業全社月平均10h以下,★前給保証★前職年収2割増しを保証【ITエンジニア】年休128日 正社員,正社員,月給30万円〜50万円 ＋ 賞与年2回 ＼前職給与の120％をお約束します！／ ★経験やスキルに応じて、50万円…
184,木下工業株式会社 | 名古屋エリアの公共事業のみ！／資格取得もサポートします！,【作業スタッフ】★月収25万円～40万円が可能★未経験歓迎 正社員,正社員,日給1万2500円〜2万円 ※月収25万円〜40万円が可能 ※経験・年齢を考慮の上、当社規定により優遇します …
185,アートバンライン株式会社 | 大手企業と多数取引で業績好調★月8～9日休み★土日休みも可,【中型(4t)トラックドライバー】面接1回★転勤なし！安定性◎ 正社員,正社員,月給15万7600円以上＋割増賃金＋残業手当+諸手当 ≪平均月収/42万円≫ ★月収例の内訳 基本給+残業代/割…
186,アートバンライン株式会社 | 大手企業と多数取引で業績好調★売上295億円を誇る安定企業,【大型(10t)ドライバー】★面接1回★無理のない配車調整で負担少 正社員,正社員,月給15万7600円以上＋割増賃金+残業手当＋諸手当 《月収例46万円》 ★月収例の内訳 基本給+残業代/割増賃…
187,アートバンライン株式会社 | 大手企業と多数取引で業績好調★月8～9日休み土日休みも可,【小型(2t)トラックドライバー】★面接1回★高定着率★[未]歓迎 正社員,正社員,月給15万7600円以上＋割増賃金＋残業手当+諸手当 《月収例37万円(入社2年目／残業20hの場合)》 ★月収例…
188,さか電工株式会社 | ★配偶者のバースデー休暇など、社員の家族も大切にする会社★,【電気工事】★月給40万円も目指せる ★経験者は前職給与を保証 正社員,正社員,"経験者…月給30万円〜（前職給与保証） 未経験…月給22万5,000円〜41万円 ※年齢、経験、能力を考慮の上…"
189,株式会社ミックウェア | ★ホンダやトヨタのパートナーとして最先端技術を駆使！,働き方が選べる【ITエンジニア】大量採用!中途入社が多数活躍中! 正社員,正社員,マネーワーク職／実力に応じた収入が可能！ 月給27万円〜47万円+賞与年4回 ※固定残業代月42時間相当（6…
190,有限会社エフォール | ≪全員面接＊働き方選べます≫初期費用0円★年齢不問,『配った荷物＝あなたの給料』【軽車両ドライバー】AT限定免許OK 業務委託,業務委託,完全出来高制 ※1件あたり150円〜180円 〓〓＜月収70万円近くも可能！＞〓〓 ※荷物単価180円の場合（…
191,株式会社昇建 | #大阪府緊急雇用対策に賛同#大阪本社#転勤なし,条件に合う方とは積極的に面接します【施工管理アシスタント】 正社員,正社員,■（１）月給25万〜40万円+諸手当＋賞与年2回 ■（２）月給30万〜50万円+諸手当＋賞与年2回 ※（１）管…
192,Rセキュリティ株式会社 | 20年連続増収増益◆2020年2~5月は売上前年比125％◆完全週休二日,"""水""というライフラインを支える【水道技師】★平均月収45万円超 正社員",正社員,月給25万円以上＋インセンティブ(歩合)＋シフト手当＋営業手当 ★年収1000万円可能 ★平均月収45万9809円…
193,メットライフ生命保険株式会社 | 【大阪府緊急雇用対策に賛同】◆賞与年4回／完全週休2日制(土日),未経験歓迎！【コンサルティング営業】環境&収入ともに抜群◎ 正社員,正社員,【初任給月給】25万円または30万円 ※初期補給の金額は前年度年収により決定。 個人成績に応じて3ヶ月ご…
194,コムズ株式会社 | 未経験でも月給25万円スタート★土日祝休/年休120日以上★,【広告運用サポート】経験者優遇★成長×高収入を叶える会社★ 正社員,正社員,★月給25万円〜45万円＋インセンティブ+各種手当 ※経験や能力に応じて決定いたします。 ※試用期間あり…
195,株式会社ゲッコー | 直行直帰可能！転勤ナシで地元で働ける＊業界経験者歓迎,20代の平均月収＝約43万円★実働6h＆残業ナシ【技術系総合職】 正社員,正社員,月給28万〜54万円 +各種手当 ※スキルや能力、希望などを考慮して、給与額を決定します。 ※試用期間1…
196,株式会社フィード | アパレルや美容業界、飲食店など異業種からの転職成功者多数！,【ライフプランアドバイザー】平均年齢24歳！マンション社宅付！ 正社員,正社員,"月給25万円以上＋高額インセンティブ＋諸手当＋賞与 ※営業手当として40時間（55,000円）分の残業代を含…"
197,株式会社つばさメディカルグループ | ■札幌でトップクラスの実績 ■社会貢献性の高い事業で急成長中,高齢者と介護施設のミスマッチをなくす！【コーディネート営業】 正社員,正社員,営業経験者：月給25万円以上 未経験者：月給23万円以上 ※別途インセンティブの支給があります。 ※経験…
198,株式会社ケニーモバイル | ★関内・横須賀で地域密着★正社員デビュー歓迎★充実の研修あり,未経験OK！【受付・販売スタッフ】★年間休日120日 ★面接1回 正社員,正社員,月給22〜39万円＋役職手当＋交通費支給 ※一律手当含む。 ※経験・能力を考慮の上、加給・優遇します。 …
199,株式会社ひまわりほーむ | ＼CMでお馴染み／　残業月平均15時間&手当など福利厚生も充実◎,【総合職（経理・営業）】★仕事とプライベートを両立できる！ 正社員,正社員,■月給／16万円〜27万円+諸手当＋インセンティブ ※試用期間(最長3ヶ月)も待遇は変わりません ♪利益は…
200,株式会社ファースト | 【不況知らずのカスタムカー専門店】＊平均年収600万円以上！,＊未経験大歓迎！残業ほぼなし・転勤なし【カーアドバイザー】 正社員,正社員,月給25万円〜＋インセンティブ(販売台数UP→金額もUP) 【平均年収600万円以上】 ＜月収例＞ 入社1ヶ月……
201,株式会社京進 | 東証二部上場,【学習塾経営】転職して社員に？いや、次のキャリアは独立だ！ FCオーナー,FCオーナー,【年間モデル収益】 年間平均生徒数が60名の場合 ◎年間売上／2733万円 ・授業料、入学料　他 ◎年間諸費…
202,株式会社CREAX | 「買取専門店 kaitori-off」設立から6期連続増収中の成長企業！,【査定スタッフ/バイヤー】未経験から1年目で30万円以上も可能 正社員,正社員,◇月給：24万円〜50万円 ＋各種手当+インセンティブ ※月給は最低保証給です。各種手当が支給されます。…
203,第一土地建物株式会社 | 【コロナ禍でも売上高UPの成長企業】★未経験人材を積極採用中★,【営業】★ノルマなし★異業種からのジョブチェンジ大歓迎！ 正社員,正社員,月給25万円以上＋インセンティブ ※あなたの経験やスキルを考慮し優遇いたします！ ※上記には、固定残業…
204,アイアール株式会社 | #選べる勤務地&休日等#土日祝休み#育児休暇取得多数#WEB面接可能,コロナ禍でも業績好調!年収120万UPも可【施工管理アシスタント】 正社員,正社員,月給28万円〜80万円+諸手当+賞与年2回 ★前職年収+120万円UPも可能！ 　経験によっては初任給月給80万円…
205,株式会社CRUD nop | ECサイト/動画配信/ゲーム等のWebシステムを手掛ける成長企業,"次は""したいこと""重視でいこう【ITエンジニア】★前給保障！ 正社員",正社員,月給25万円〜＋賞与年2回 ※経験・スキル・年齢を考慮の上、決定します。 ※上記金額には固定残業代20時…
206,株式会社スタッフファースト | <東証一部上場企業(DmMiX社)のグループ企業>★前年比250％の成長,【人材コーディネーター】★未経験者歓迎★フレックスタイムOK 正社員,正社員,＜新宿勤務＞ ■月給22万円〜（一律手当含む）＋インセンティブ＋賞与 ※試用期間2ヵ月あり（期間中も待…
207,佐藤建業株式会社 | 今年で創立61周年！杉並区・都内の地域に密着した工事事業を展開,【施工管理】官公庁・自治体からの依頼多数◎安定環境で成長！ 正社員,正社員,"【未経験】月給28万円〜35万円 上記には固定残業代（70,000円〜87,500円/45時間分）を含む。 超過分別途…"
208,株式会社アイダ設計 | テレビCMでお馴染みの企業！成長が止まらないハウスメーカー！,100％反響型の【戸建住宅のアドバイザー】★女性も活躍中♪ 正社員,正社員,【月給】20万円〜30万円 ※当初6ヵ月間は契約社員(給与は同額)その後、正社員として雇用 【入社時月収例…
209,株式会社novis | 【 高収入も目指せる転職先 】年休123日／賞与年2回＋決算賞与,若手育成採用！省エネ商材の専門商社【提案営業】◎土日祝休み！ 正社員,正社員,月給23万円以上＋賞与年2回＋決算賞与 ※上記は最低保証金額です ※経験・能力を考慮の上、決定いたしま…
